{
  "$schema": "https://json-schema.org/draft/2020-12/schema",
  "$id": "https://skenion.dev/schemas/package/v0.1/package-discovery.schema.json",
  "title": "skenion Package Discovery Response v0.1",
  "type": "object",
  "required": [
    "schema",
    "schemaVersion",
    "ok",
    "listings",
    "diagnostics"
  ],
  "properties": {
    "schema": {
      "const": "skenion.package.discovery"
    },
    "schemaVersion": {
      "const": "0.1.0"
    },
    "ok": {
      "type": "boolean"
    },
    "listings": {
      "type": "array",
      "items": {
        "$ref": "https://skenion.dev/schemas/package/v0.1/package-listing.schema.json"
      }
    },
    "diagnostics": {
      "type": "array",
      "items": {
        "$ref": "https://skenion.dev/schemas/package/v0.1/package-listing.schema.json#/$defs/packageListingDiagnostic"
      }
    }
  },
  "additionalProperties": false
}
